{"$schema":"https://json-schema.org/draft/2020-12/schema","type":"object","required":["event_id","event_type","mode","lrn_id","lrn_version","governance_state","commercial_eligibility","cost_profile_id","cost_profile_version","quantity","gross_minor_units","resource_cost_minor_units","allocations_minor_units","remaining_balance_minor_units","payable_creator_balance_minor_units","currency","timestamp","status"],"properties":{"event_id":{"type":"string","pattern":"^ECO-[A-Z0-9-]+$"},"event_type":{"enum":["usage","charge","refund","creator_revenue","platform_fee","validation_compensation","audit_compensation","adjustment"]},"mode":{"enum":["REAL","SIMULATION"]},"lrn_id":{"type":"string","minLength":1},"lrn_version":{"type":"string","pattern":"^\\d+\\.\\d+\\.\\d+$"},"governance_state":{"enum":["proposed","testing","validated","active","suspended","retired"]},"commercial_eligibility":{"enum":["not_eligible","eligible_by_policy"]},"cost_profile_id":{"type":"string","pattern":"^COST-[A-Z0-9-]+$"},"cost_profile_version":{"type":"string","pattern":"^\\d+\\.\\d+\\.\\d+$"},"quantity":{"type":"integer","minimum":1},"gross_minor_units":{"type":"integer","minimum":0},"resource_cost_minor_units":{"type":"integer","minimum":0},"allocations_minor_units":{"type":"object","required":["creator","platform","governance","review_pool"],"properties":{"creator":{"type":"integer","minimum":0},"platform":{"type":"integer","minimum":0},"governance":{"type":"integer","minimum":0},"review_pool":{"type":"integer","minimum":0}},"additionalProperties":false},"remaining_balance_minor_units":{"type":"integer","minimum":0},"payable_creator_balance_minor_units":{"type":"integer","minimum":0},"currency":{"type":"string","pattern":"^[A-Z]{3}$"},"review_work_units":{"type":"integer","minimum":0},"compensation_rate_minor_units":{"type":"integer","minimum":0},"review_decision":{"enum":["APPROVE","REJECT","REQUEST_CHANGES","SUSPEND","REVALIDATE"]},"timestamp":{"type":"string","format":"date-time"},"status":{"enum":["conceptual","pending","recorded","void"]}},"additionalProperties":false}
